{"$schema":"http://json-schema.org/draft-07/schema#","properties":{"$schema":{"const":"./i18n-schema.json"},"about":{"type":"string"},"title":{"type":"string"},"moveAround_desc":{"type":"string"},"moveAround_title":{"type":"string"},"closeThisPage_desc":{"type":"string"},"closeThisPage_title":{"type":"string"},"getSpecificHelp_desc":{"type":"string"},"getSpecificHelp_helpContext":{"type":"string"},"getSpecificHelp_helpSummary":{"type":"string"},"getSpecificHelp_helpSyntax":{"type":"string"},"getSpecificHelp_title":{"type":"string"},"getSpecificHelp_table_head_example":{"type":"string"},"getSpecificHelp_table_head_prepend":{"type":"string"},"getSpecificHelp_table_head_what":{"type":"string"},"getSpecificHelp_table_cmdLineMode_example":{"type":"string"},"getSpecificHelp_table_cmdLineMode_prepend":{"type":"string"},"getSpecificHelp_table_cmdLineMode_what":{"type":"string"},"getSpecificHelp_table_insertMode_example":{"type":"string"},"getSpecificHelp_table_insertMode_what":{"type":"string"},"getSpecificHelp_table_normalMode_example":{"type":"string"},"getSpecificHelp_table_normalMode_what":{"type":"string"},"getSpecificHelp_table_notesMode_example":{"type":"string"},"getSpecificHelp_table_notesMode_what":{"type":"string"},"getSpecificHelp_table_preference_example":{"type":"string"},"getSpecificHelp_table_preference_what":{"type":"string"},"getSpecificHelp_table_visualMode_example":{"type":"string"},"getSpecificHelp_table_visualMode_what":{"type":"string"},"searchForHelp_desc":{"type":"string"},"searchForHelp_title":{"type":"string"}},"required":["$schema","about","title","moveAround_desc","moveAround_title","closeThisPage_desc","closeThisPage_title","getSpecificHelp_desc","getSpecificHelp_helpContext","getSpecificHelp_helpSummary","getSpecificHelp_helpSyntax","getSpecificHelp_title","getSpecificHelp_table_head_example","getSpecificHelp_table_head_prepend","getSpecificHelp_table_head_what","getSpecificHelp_table_cmdLineMode_example","getSpecificHelp_table_cmdLineMode_prepend","getSpecificHelp_table_cmdLineMode_what","getSpecificHelp_table_insertMode_example","getSpecificHelp_table_insertMode_what","getSpecificHelp_table_normalMode_example","getSpecificHelp_table_normalMode_what","getSpecificHelp_table_notesMode_example","getSpecificHelp_table_notesMode_what","getSpecificHelp_table_preference_example","getSpecificHelp_table_preference_what","getSpecificHelp_table_visualMode_example","getSpecificHelp_table_visualMode_what","searchForHelp_desc","searchForHelp_title"],"additionalProperties":false,"title":"vimdoku-${principal.name}-i18n","type":"object"}