{
	"$schema": "./i18n-schema.json",
	"about": "Vimdoku is a cross between the words <a href=\"en/intro#vim\">VIM</a> and <a href=\"en/intro#sudoku\">suDOKU</a>. Most of it is made by <a href=\"github.com/matrosmartz\">Matros Martz</a>, but you can contribute. <a href=\"en/help/contributing\">See how</a> (please, I don't know how to finish the documentation...).",
	"closeThisPage_desc": "Use <span class=\"highlight\"> <a href=\"en/help/editing#%3Aquit\"><span class=\"command\">q</span></a><span class=\"key\">Enter</span></span>.",
	"closeThisPage_title": "Close this page",
	"getSpecificHelp_desc": "It is possible to go directly to whatever you want <a href=\"en/help/help#help\">help</a> on, by giving an argument to the <span class=\"highlight\"><a href=\"en/help/help#%3Ahelp\"><span class=\"command\">help</span></a></span> command.",
	"getSpecificHelp_helpContext": "Prepend something to specify the context",
	"getSpecificHelp_helpSummary": "See <a href=\"en/help/usr_02#help-summary\">help-summary</a> for more contexts and an explication.",
	"getSpecificHelp_helpSyntax": "See <a href=\"en/help/intro#notation\">notation</a> for an explanation of the <a href=\"en/help/help#help\">help</a> syntax.",
	"getSpecificHelp_table_cmdLineMode_example": "<span class=\"highlight\"><a ahref=\"en/help/help#%3Ahelp\"><span class=\"command\">help</span></a><a href=\"en/help/editing#%3Aquit\"><span class=\"command\">quit</span></a></span>",
	"getSpecificHelp_table_cmdLineMode_prepend": "<a href=\"en/help/cmdLine#%3A\">:</a>",
	"getSpecificHelp_table_cmdLineMode_what": "<a href=\"en/help/cmdline#command-line\">Command-line</a> mode command",
	"getSpecificHelp_table_head_example": "ExAMPLE",
	"getSpecificHelp_table_head_prepend": "PREPEND",
	"getSpecificHelp_table_head_what": "WHAT",
	"getSpecificHelp_table_insertMode_example": "<span class=\"highlight\"><a href=\"en/help/help#%3Ahelp\"><span class=\"command\">help</span></a><a href=\"en/help/insert#i_<esc>\">i_<span class=\"key\">Esc</span></a></span>",
	"getSpecificHelp_table_insertMode_what": "<a href=\"en/help/insert#insert\">Insert</a> mode command",
	"getSpecificHelp_table_normalMode_example": "<span class=\"highlight\"><a href=\"en&/help/help#%3Ahelp\"><span class=\"command\">help</span></a> x</span>",
	"getSpecificHelp_table_normalMode_what": "<a href=\"en/help/intro#normal\">Normal</a> mode command",
	"getSpecificHelp_table_notesMode_example": "<span class=\"highlight\"><a href=\"en/help/help#%3Ahelp\"><span class=\"command\">help</span></a><a href=\"en/help/notes#n_<esc>\">n_<span class=\"key\">Esc</span></a></span>",
	"getSpecificHelp_table_notesMode_what": "<a href=\"en/help/notes#Notes\">Notes</a> mode command",
	"getSpecificHelp_table_preference_example": "<span class=\"highlight\"><a href=\"en/help/help#%3Ahelp\"><span class=\"command\">help</span></a><a href=\"en/help/options#%27autoSave%27\"><span class=\"text\">autoSave</span></a></span>",
	"getSpecificHelp_table_preference_what": "Preference",
	"getSpecificHelp_table_visualMode_example": "<span class=\"highlight\"><a href=\"en/help/help#%3Ahelp\"><span class=\"command\">help</span></a> v_u</span>",
	"getSpecificHelp_table_visualMode_what": "<a href=\"en/help/visual#visual\">Visual</a> mode command",
	"getSpecificHelp_title": "Get specific help",
	"moveAround_desc": "Use the cursor keys, or <a class=\"motion-letter\" href=\"en/help/motion#h\">h</a> to go left, <a class=\"motion-letter\" href=\"en/help/motion#j\">j</a> to go down, <a class=\"motion-letter\" href=\"en/help/motion#k\">k</a> to go up, <a class=\"motion-letter\" href=\"en/help/motion#l\">l</a> to go right.",
	"moveAround_title": "Move around",
	"searchForHelp_desc": "Type \"<span class=\"highlight\"><a href=\"en/help/help#%3Ahelp\"><span class=\"command\">help</span></a> <a href=\"en/help/motion/word\">word</a></span>\" then hit <span class=\"combination\"><a href=\"en/help/scroll#ctrl-d\">CTRL-D</a></span> to see matching entries <a href=\"en/help/help#help\">help</a> entries for \"<a href=\"en/help/motion/word\">word</a>\".",
	"searchForHelp_title": "Search for help",
	"title": "Main <a href=\"en/help/help#help\">help</a> file."
}
