{
	"$schema": "./i18n-schema.json",
	"about": "Vimdoku es una combinación de las palabras <a href=\"en/intro#vim\">VIM</a> y <a href=\"en/intro#sudoku\">suDOKU</a>. La mayor parte fue creada por <a href=\"github.com/matrosmartz\">Matros Martz</a>, pero puedes contribuir. <a href=\"en/help/contributing\">Mira cómo</a> (por favor, no sé cómo terminar la documentación...).",
	"closeThisPage_desc": "Utiliza <span class=\"highlight\"> <a href=\"en/help/editing#%3Aquit\"><span class=\"command\">q</span></a><span class=\"key\">Enter</span></span>.",
	"closeThisPage_title": "Cerrar esta pagina",
	"getSpecificHelp_desc": "Es posible ir directamente a la <a href=\"en/help/help#help\">ayuda</a> que quieras, dando un argumento al comando <span class=\"highlight\"><a href=\"en/help/help#%3Ahelp\"><span class=\"command\">help</span></a></span>",
	"getSpecificHelp_helpContext": "Añade algo para especificar el contexto",
	"getSpecificHelp_helpSummary": "Ver <a href=\"en/help/usr_02#help-summary\">resumen de ayuda</a> para más contextos y una explicación.",
	"getSpecificHelp_helpSyntax": "Ver <a href=\"en/help/intro#notation\">notación</a> para una explicación de la sintaxis de la <a href=\"en/help/help#help\">ayuda</a>.",
	"getSpecificHelp_table_cmdLineMode_example": "<span class=\"highlight\"><a href=\"en/help/help#%3Ahelp\"><span class=\"command\">help</span></a> <a href=\"en/help/editing#%3Aquit\"><span class=\"command\">quit</span></a></span>",
	"getSpecificHelp_table_cmdLineMode_prepend": "<a href=\"en/help/cmdLine#%3A\">:</a>",
	"getSpecificHelp_table_cmdLineMode_what": "Comando del modo de <a href=\"en/help/cmdline#command-line\">línea de comandos</a>",
	"getSpecificHelp_table_head_example": "EJEMPLO",
	"getSpecificHelp_table_head_prepend": "ANTEPONER",
	"getSpecificHelp_table_head_what": "QUÉ",
	"getSpecificHelp_table_insertMode_example": "<span class=\"highlight\"><a href=\"en/help/help#%3Ahelp\"><span class=\"command\">help</span></a> <a href=\"en/help/insert#i_<esc>\">i_<span class=\"key\">Esc</span></a></span>",
	"getSpecificHelp_table_insertMode_what": "Comando del modo de <a href=\"en/help/insert#insert\">inserción</a>",
	"getSpecificHelp_table_normalMode_example": "<span class=\"highlight\"><a href=\"en/help/help#%3Ahelp\"><span class=\"command\">help</span></a> x</span>",
	"getSpecificHelp_table_normalMode_what": "Comando del modo <a href=\"en/help/intro#normal\">normal</a>",
	"getSpecificHelp_table_notesMode_example": "<span class=\"highlight\"><a href=\"en/help/help#%3Ahelp\"><span class=\"command\">help</span></a> <a href=\"en/help/notes#n_<esc>\">n_<span class=\"key\">Esc</span></a></span>",
	"getSpecificHelp_table_notesMode_what": "Comando del modo de <a href=\"en/help/notes#Notes\">notas</a>",
	"getSpecificHelp_table_preference_example": "<span class=\"highlight\"><a href=\"en/help/help#%3Ahelp\"><span class=\"command\">help</span></a> <a href=\"en/help/options#%27autoSave%27\"><span class=\"text\">autoSave</span></a></span>",
	"getSpecificHelp_table_preference_what": "Preferencia",
	"getSpecificHelp_table_visualMode_example": "<span class=\"highlight\"><a href=\"en/help/help#%3Ahelp\"><span class=\"command\">help</span></a> v_u</span>",
	"getSpecificHelp_table_visualMode_what": "Comando del modo <a href=\"en/help/visual#visual\">visual</a>",
	"getSpecificHelp_title": "Obtener ayuda específica",
	"moveAround_desc": "Utiliza las teclas de cursor, o <a class=\"motion-letter\" href=\"en/help/motion#h\">h</a> para ir a la izquierda, <a class=\"motion-letter\" href=\"en/help/motion#j\">j</a> para bajar, <a class=\"motion-letter\" href=\"en/help/motion#k\">k</a> para subir, <a class=\"motion-letter\" href=\"en/help/motion#l\">l</a> para ir a la derecha.",
	"moveAround_title": "Moverse por",
	"searchForHelp_desc": "Escribe «<span class=\"highlight\"><a href=\"en/help/help#%3Ahelp\"><span class=\"command\">help</span></a> <a href=\"en/help/motion/word\">word</a></span>» y luego presiona <span class=\"combination\"><a href=\"en/help/scroll#ctrl-d\">CTRL-D</a></span> para ver entradas coincidentes de la <a href=\"en/help/help#help\">ayuda</a> para «<a href=\"en/help/motion/word\">word (palabra)</a>».",
	"searchForHelp_title": "Buscar ayuda",
	"title": "Archivo principal de <a href=\"en/help/help#help\">ayuda</a>."
}
